{
  "schemaVersion": 1,
  "modelVersion": "0.1.0",
  "productId": "abc-design-salsa-5-air",
  "identity": {
    "brand": "ABC Design",
    "model": "Salsa 5 Air",
    "generation": "Salsa 5 Air current DE listing 12005032517",
    "market": "DE",
    "category": "single-combi-from-birth",
    "supportedChildren": 1
  },
  "review": {
    "status": "pilot",
    "checkedAt": "2026-07-22",
    "reviewDueAt": "2026-08-22",
    "reviewedBy": "AI research pilot",
    "pilotArchetype": "Großer Kombiwagen für Stadt und Natur",
    "notes": "Hersteller veröffentlicht ungewöhnlich detaillierte Komponenten-, Rad- und Kofferraumdaten."
  },
  "sources": [
    {
      "id": "abc-salsa-product",
      "url": "https://www.abc-design.de/kombi-kinderwagen-salsa-5-air-coal",
      "kind": "manufacturer",
      "title": "ABC Design Salsa 5 Air Produktseite",
      "checkedAt": "2026-07-22"
    },
    {
      "id": "abc-salsa-manual",
      "url": "https://ch.abc-design.de/media/d9/6b/84/1724314198/1200503_Salsa%205%20Air%20ABC.2025.1_web.pdf?ts=1724314198",
      "kind": "manual",
      "title": "ABC Design Salsa 5 Air Anleitung",
      "checkedAt": "2026-07-22"
    }
  ],
  "facts": {
    "marketStatus": { "value": "current_available", "sourceIds": ["abc-salsa-product"], "checkedAt": "2026-07-22", "status": "officially_documented", "note": "Hersteller-Shop nennt das geprüfte Design als sofort verfügbar; Farben können abweichen.", "freshUntil": "2026-08-05" },
    "newbornApproved": { "value": true, "sourceIds": ["abc-salsa-product", "abc-salsa-manual"], "checkedAt": "2026-07-22", "status": "officially_documented" },
    "newbornConfiguration": { "value": "Salsa 5 Air mit enthaltener Babywanne", "sourceIds": ["abc-salsa-product"], "checkedAt": "2026-07-22", "status": "officially_documented" },
    "carrycotIncluded": { "value": true, "sourceIds": ["abc-salsa-product"], "checkedAt": "2026-07-22", "status": "officially_documented" },
    "requiredConfigurationPriceEur": { "value": 899.9, "unit": "EUR", "sourceIds": ["abc-salsa-product"], "checkedAt": "2026-07-22", "status": "officially_documented", "note": "Aktionspreis; regulärer Preis 949,90 Euro.", "freshUntil": "2026-08-05" },
    "unfoldedWidthCm": { "value": 63, "unit": "cm", "sourceIds": ["abc-salsa-product"], "checkedAt": "2026-07-22", "status": "officially_documented" },
    "foldedDimensionsCm": { "value": { "length": 86, "width": 63, "height": 42, "configuration": "with_wheels_and_seat" }, "unit": "cm", "sourceIds": ["abc-salsa-product"], "checkedAt": "2026-07-22", "status": "officially_documented", "note": "Sportsitz kann montiert bleiben; Babywanne muss abgenommen werden. Ohne Räder 71,5 x 55 x 24,5 cm." },
    "frameWeightKg": { "value": 10.1, "unit": "kg", "sourceIds": ["abc-salsa-product"], "checkedAt": "2026-07-22", "status": "officially_documented" },
    "seatWeightKg": { "value": 4.8, "unit": "kg", "sourceIds": ["abc-salsa-product"], "checkedAt": "2026-07-22", "status": "officially_documented" },
    "carrycotWeightKg": { "value": null, "unit": "kg", "sourceIds": [], "checkedAt": "2026-07-22", "status": "unknown" },
    "liftReadyWeightKg": { "value": 14.9, "unit": "kg", "sourceIds": ["abc-salsa-product"], "checkedAt": "2026-07-22", "status": "derived_proxy", "note": "Gestell 10,1 kg plus Sitzeinheit 4,8 kg; Zubehörgewicht nicht eingerechnet." },
    "liftReadyConfiguration": { "value": "frame_with_seat", "sourceIds": ["abc-salsa-product"], "checkedAt": "2026-07-22", "status": "derived_proxy" },
    "pushbarMinCm": { "value": 98, "unit": "cm", "sourceIds": ["abc-salsa-product"], "checkedAt": "2026-07-22", "status": "officially_documented" },
    "pushbarMaxCm": { "value": 107.5, "unit": "cm", "sourceIds": ["abc-salsa-product"], "checkedAt": "2026-07-22", "status": "officially_documented" },
    "wheelDiameterFrontCm": { "value": 24.5, "unit": "cm", "sourceIds": ["abc-salsa-product"], "checkedAt": "2026-07-22", "status": "officially_documented" },
    "wheelDiameterRearCm": { "value": 27.5, "unit": "cm", "sourceIds": ["abc-salsa-product"], "checkedAt": "2026-07-22", "status": "officially_documented" },
    "wheelMaterial": { "value": "air-filled", "sourceIds": ["abc-salsa-product"], "checkedAt": "2026-07-22", "status": "officially_documented" },
    "suspension": { "value": "individual wheel suspension plus rear axle suspension", "sourceIds": ["abc-salsa-product"], "checkedAt": "2026-07-22", "status": "officially_documented" },
    "basketLoadKg": { "value": 5, "unit": "kg", "sourceIds": ["abc-salsa-product"], "checkedAt": "2026-07-22", "status": "officially_documented" },
    "basketVolumeL": { "value": null, "unit": "l", "sourceIds": [], "checkedAt": "2026-07-22", "status": "unknown" },
    "oneHandFold": { "value": false, "sourceIds": ["abc-salsa-product"], "checkedAt": "2026-07-22", "status": "officially_documented", "note": "Zweihand-Falten laut technischen Daten." },
    "foldWithSeat": { "value": true, "sourceIds": ["abc-salsa-product"], "checkedAt": "2026-07-22", "status": "officially_documented" },
    "selfStandingFold": { "value": null, "sourceIds": [], "checkedAt": "2026-07-22", "status": "unknown" },
    "reversibleSeat": { "value": true, "sourceIds": ["abc-salsa-product"], "checkedAt": "2026-07-22", "status": "officially_documented" },
    "travelSystem": { "value": true, "sourceIds": ["abc-salsa-product"], "checkedAt": "2026-07-22", "status": "officially_documented", "note": "Optionale Adapter erforderlich." },
    "canopyCoverage": { "value": "extendable UPF 50+", "sourceIds": ["abc-salsa-product"], "checkedAt": "2026-07-22", "status": "officially_documented" },
    "canopyVentilation": { "value": true, "sourceIds": ["abc-salsa-product"], "checkedAt": "2026-07-22", "status": "officially_documented" },
    "rainCoverIncluded": { "value": false, "sourceIds": ["abc-salsa-product"], "checkedAt": "2026-07-22", "status": "officially_documented", "note": "Nicht im veröffentlichten Lieferumfang." },
    "sparePartsAvailability": { "value": null, "sourceIds": [], "checkedAt": "2026-07-22", "status": "unknown" },
    "repairService": { "value": "two-year premium manufacturer service", "sourceIds": ["abc-salsa-product"], "checkedAt": "2026-07-22", "status": "officially_documented", "note": "Leistungsumfang des Service im Pilot nicht vertieft geprüft." },
    "warrantyYears": { "value": 2, "unit": "years", "sourceIds": ["abc-salsa-product"], "checkedAt": "2026-07-22", "status": "officially_documented" },
    "officialSafetyNoticeStatus": { "value": "not_checked_in_pilot", "sourceIds": [], "checkedAt": "2026-07-22", "status": "unknown", "note": "Kein Sicherheitsurteil ableiten." }
  },
  "signals": {
    "cityManeuverability": { "value": 0.5, "status": "proxy", "evidenceFields": ["unfoldedWidthCm", "liftReadyWeightKg", "wheelDiameterFrontCm"], "rationale": "Breiter und schwerer als kompakte Pilotmodelle; keine unabhängige Handhabungsprüfung." },
    "roughSurfaceFit": { "value": 0.5, "status": "proxy", "evidenceFields": ["wheelDiameterFrontCm", "wheelDiameterRearCm", "wheelMaterial", "suspension"], "rationale": "Große Lufträder und konkrete Federung dokumentiert; Herstellerdaten werden ohne unabhängige Fahrprüfung auf 0,5 begrenzt." },
    "foldingConvenience": { "value": 0.5, "status": "proxy", "evidenceFields": ["foldedDimensionsCm", "oneHandFold", "foldWithSeat"], "rationale": "Mit Sitz faltbar, aber Zweihand-Vorgang und großes Standard-Faltmaß." },
    "storageCapacity": { "value": 0.5, "status": "documented", "evidenceFields": ["basketLoadKg", "basketVolumeL"], "rationale": "5 kg Traglast dokumentiert; Volumen fehlt." },
    "weatherProtection": { "value": 1, "status": "documented", "evidenceFields": ["canopyCoverage", "canopyVentilation", "rainCoverIncluded"], "rationale": "Erweiterbares UPF-50+-Verdeck und Belüftung dokumentiert; Regenverdeck nicht enthalten." },
    "repairabilityService": { "value": 0.5, "status": "proxy", "evidenceFields": ["sparePartsAvailability", "repairService", "warrantyYears"], "rationale": "Herstellerservice und Garantie genannt; Ersatzteilumfang und tatsächliche Reparaturwege offen." },
    "longTermFlexibility": { "value": 1, "status": "documented", "evidenceFields": ["newbornConfiguration", "reversibleSeat", "travelSystem"], "rationale": "Babywanne enthalten, Sitz wendbar und Travel-System möglich." }
  },
  "editorial": {
    "bestFor": ["Wald-, Feld- und Schotterwege", "komplette Geburtskonfiguration", "Familien mit großem Kofferraum"],
    "tradeoffs": ["14,9 kg mit Sitzeinheit", "63 cm breit", "Zweihand-Faltung"],
    "openChecks": ["Standard-Faltmaß inklusive Sitz im eigenen Auto prüfen", "Lufträder und Wartungsaufwand abwägen"],
    "dataConflicts": [],
    "visualStyles": ["sporty_technical", "classic_elegant"],
    "testingDisclosure": "Kein eigener Produkttest; Passung aus dokumentierten Produktdaten und ausgewiesenen Proxys abgeleitet."
  }
}
